{
  "schema_version": 1,
  "map_id": 8,
  "size": [
    128,
    128
  ],
  "custom_map": [
    "00000000000000000000000000000000000000000000000000000000000000000000000000000000000000000000000000000000000000000000000000000000",
    "00000000000000000000000000000000000000000000000000000000000000000000000000000000000000000000000000000000000000000000000000000000",
    "00000000000000000000000000000000000000000000000000000000000000000000000000000000022000000000000000000000000000000000000000000000",
    "00000000000000000000000000000000000000000000000000000000000000000000000000000000222200000000000000000000000000000000000000000000",
    "00000000000000000000000000000000000000000000000000000000000000000000000000000002222220000000000000000000000000000000000000000000",
    "00000000000000000000000000000000000000000000000000000000000000000000000000000022222222200000000000000000000000000000000000000000",
    "00000000000000000000000000000000000000000000000000000000000000000000000000002222222222220000000000000000000000000000000000000000",
    "00000000000000000000000000000000000000000000000000000000000000000000000000022222222222222000000000000000000000000000000000000000",
    "00000000000000000000000000000000000000000000000000000000000000000000000000222222222222220000000000000000000000000000000000000000",
    "00000000000000000000000000000000000000000000000000000000000000000000000002222222222222220000000000000000000000000000000000000000",
    "00000000000000000000000000000000000000000000000000000000000000000000000022222222222222220000000000000000000000000000000000000000",
    "00000000000000000000000000000000000000000000000000000000000000000000000222222222222222220000000000000000000000000000000000000000",
    "00000000000000000000000000000000000000000000000000000000000000000000000222222222222222220000000000000000000000000000000000000000",
    "00000000000000000000000000000000000000000000000000000000000000000000000222222222222222220000000000000000000000000000000000000000",
    "00000000000000000000000000000000000000000000000000000000000000000000000222222222222222220000000000000000000000000000000000000000",
    "00000000000000000000000000000000000000000000000000000000000000000000000222222222222222222000000000000000000000000000000000000000",
    "00000000000000000000000000000000000000000000000000000000000222222222222222222222222222222222222200000000000000000000000000000000",
    "00000000000000000000000000000000000000000000000000000000000222222222222222222222222222222222222200000000000000000000000000000000",
    "00000000000000000000000000000000000000000000000000000000000222222222222222222222222222222222222200000000000000000000000000000000",
    "00000000000000000000000000000000000000000000000000000000000222222222222222222222222222222222222200000000000000000000000000000000",
    "00000000000000000000000000000000000000000000000000000000000222222222222222222222222222222222222200000000000000000000000000000000",
    "00000000000000000000000000000000000000000000000000000000000222222222222222222222222222222222222200000000000000000000000000000000",
    "00000000000000000000000000000000000000000000000000000000000222222222222222222222222222222222222200000000000000000000000000000000",
    "00000000000000000000000000000000000000000000000000000000000222222222222222000000002222222222222200000000000000000000000000000000",
    "00000000000000000000000000000000000000000000000000000000000222222222222222000000002222222222222200000000000000000000000000000000",
    "00000000000000000000000000000000000000000000222222222222222222222222222222000000002222222222222200000000000000000000000000000000",
    "00000000000000000000000000000000000000000002222222222222222222222222222222000000002222222222222222222222222222222222000000000000",
    "00000000000000000000000000000000000000000002222222222222222222222222222222000000002222222222222222222222222222222222000000000000",
    "00000000000000000000000000000000000000000002222222222222222222222222222222000000002222222222222222222222222222222222000000000000",
    "00000000000000000000000000000000000000000002222222222222222222222222222222000000002222222222222222222222222222222222000000000000",
    "00000000000000000000000000000000000000000002222222222222222222222222222222000000002222222222222222222222222222222222000000000000",
    "00000000000000000000000000000000000000000002222222222222222222222222222222000000002222222222222222222222222222222222000000000000",
    "00000000000000000000000000000000000000000002222220000000000000000000022222000000000000002222222222222222222222222222222000000000",
    "00000000000000000000000000000222222222222222222220000000000000222222022222000000000000002222222222222222222222222222222000000000",
    "00000000000000000000000000002222222222222222222220000000000000222222022222000000000000002222222222222222222222222222222000000000",
    "00000000000000000000000000002222222222222222222220000000000000222222022222000000000000002222222222222222222222222222222220000000",
    "00000000000000000000000000002222222222222222222220000000000000222222022222000000000000002222222222222222222222222222222222200000",
    "00000000000000000000000000002222222222222222222220000000000000222222022222000000000000002222222222222222222222222222222222200000",
    "00000022222222222222222222222222222222222222222220000000000000222222222222000000000000002222222222222222222222222222222222200000",
    "00000022222222222222222222222222222222222222222220000000000222222222222222200000000000002222222222000002222222222222222222200000",
    "00000022222222222222222222222222222200002222222220000000002222222222222222220000000000002222222200000002222222222222222222222000",
    "00000022222222222222222222222222222200002222222222222220022222222222222222222000000000002222222200000022222222222222222222222000",
    "00000022222222220002222222222222222200002222222222222220222222222222222222222200000000002222222200022222222222222222222222222000",
    "00000022222222220002222222222222222200002222222222222222222222222222222222222200000000002222222200022222222222222222222222222000",
    "00000022222222220002222222222222222200002222222222222222222222222222222222222200000000002222222200022222222222222222222222222000",
    "00000022222222222222222222222222222200002222222222222222222222222222222222222202222222222222222200022222222222222222222222222000",
    "00000022222222222222222222222222222200002222222222222222222222222222222222222202222222222222222200022222222222222222222222222000",
    "00000022222222222222222222222222222200002222222222222222222222222222222222222222222222222222222200022222222222222222222222222000",
    "00000022222222222222222222222222222200002222222222222220022222222222222222222222222222222222222200022222222222222222222222222000",
    "00000022222222222222222222222222222200002222222222222220022222222222222222222222222222222222222200022222222222222222222222222000",
    "00000022222200022222222222222222222200002222222222222220022222222222222222222222222222222222222200022222222222222222222222222000",
    "00000022222200022222222222222222222200002222222222222220022222222222222222222222222222222222222200022222222222222222222222222000",
    "00000022222200022222222222222222222200002222222222222220022222222222222222222202222222222222222200022222222222222222222222222000",
    "00000022222222222222222222222222200000002222222222222220022222222222222222222200000000000000000000022222222222222222222222222000",
    "00000022222222222222222222222222200000002222222222222220022222222222222222222200000000000000000000022222222222222222222222222000",
    "00000022222222222222222222222222200000000022222222222220022222222222222222222200000000000000000000022222222222222222222222222000",
    "00000022222222222222222222222222200000000022222222222220022222222222222222222222222222222222222000022222222222222222222222222000",
    "00000022222222222222222222222222222222222222222222222220022222222222222222222222222222222222222000000022222222222222222222222000",
    "00000022222222220002222222222222222222222222222222222220022222222222222222222222222222222222222222222222222222222222222222222000",
    "00000022222222220002222222222222222222222222222222222220022222222222222222222222222222222222222222222222222222222222222220000000",
    "00000022222222220002222222222222222222222222222222222220022222222222222200000022222222222222222222222222222222222222222220000000",
    "00000022222222222222222222222222222222222222222222222220022222222222222200000022222222222222222222222222222222222222222220000000",
    "00000022222222222222222222222222000000000022222222222220022222222222222200000022222222222222222222222222222222222222222220000000",
    "00000022222222222222222222222222000000000022222222222220022222222222222200000022222222222222220000000000222222222222222220000000",
    "00000022222222222222222222222222000000000022222222222220022222222222222200000022222222222000000000000000222222222222222220000000",
    "00000022222222222222222000000000000000000022222222222220022222222222222000000000222222000000000000000000222222222222222220000000",
    "00000022222200022222222000000000000000000022222222222220022222222222222200000000222222000000000000000000222222222222222220000000",
    "00000022222200022222222000000000000000000022222222222220000022222222222200000000222222000000000000000000000000000222222222222000",
    "00000000000000002222222000000000000000000022222222222220000022222222222200000000222222000000000000000000000000002222222222222000",
    "00000000000000002222222000000000000000000022222222200000000022222222222200000000222222000000000000000000000000222222222222222000",
    "00000000000000002222222000000000000000000022222222200000000022222222222200000000222222000000000000000000000022222222222222222000",
    "00000000000000002222222000000000000000000022222222222220000022222222222200000000222222000222222200000000002222222222222222222000",